{
  "module": "WHATSAPP",
  "schema_version": "1.0.0",
  "generated_at": "2026-09-06T15:56:24.387Z",
  "harvester_version": "1.0.0",
  "components": [
    {
      "id": "COMP-PLATFORM-055",
      "name": "RecordWhatsAppShareRequest",
      "kind": "dto",
      "path": "src/Api/Contracts/WhatsApp/RecordWhatsAppShareRequest.cs",
      "module": "WHATSAPP",
      "layer": "Api",
      "purpose": null,
      "simple_explanation": null,
      "technical_explanation": null,
      "knowledge_ref": null,
      "features": [],
      "requirements": [],
      "test_cases": [],
      "machine": {
        "namespace": "MathilensERP.Api.Contracts.WhatsApp",
        "declaration": "public sealed record RecordWhatsAppShareRequest(Guid CustomerId, string OrderNumber, string InvoiceNumber);",
        "line": 14,
        "modifiers": [
          "public",
          "sealed"
        ],
        "base_types": [],
        "attributes": [],
        "members": [
          {
            "name": "CustomerId",
            "kind": "property",
            "signature": "Guid CustomerId",
            "line": 14,
            "modifiers": [
              "positional"
            ],
            "attributes": []
          },
          {
            "name": "OrderNumber",
            "kind": "property",
            "signature": "string OrderNumber",
            "line": 14,
            "modifiers": [
              "positional"
            ],
            "attributes": []
          },
          {
            "name": "InvoiceNumber",
            "kind": "property",
            "signature": "string InvoiceNumber",
            "line": 14,
            "modifiers": [
              "positional"
            ],
            "attributes": []
          }
        ],
        "depends_on": [
          {
            "target": "Guid",
            "target_component": null,
            "via": "constructor-injection",
            "confidence": "CONFIRMED"
          },
          {
            "target": "string",
            "target_component": null,
            "via": "constructor-injection",
            "confidence": "CONFIRMED"
          },
          {
            "target": "string",
            "target_component": null,
            "via": "constructor-injection",
            "confidence": "CONFIRMED"
          }
        ],
        "doc_citations": [],
        "incident_comments": [],
        "git": {
          "state": "COMMITTED",
          "last_commit": "ae261733672cc9331dbadba1aa5d7d897e8890d2",
          "last_commit_date": "2026-08-20",
          "last_commit_subject": "Hand a customer their order over WhatsApp, and record the fit in words as well as figures",
          "commit_count": 1
        },
        "metrics": {
          "lines": 15,
          "member_count": 3,
          "dependency_count": 3
        }
      },
      "status": "active",
      "data_classification": "PUBLIC_SAFE",
      "provenance": {
        "generator": "harvest-source.mjs",
        "generator_version": "1.0.0",
        "generated_at": "2026-09-06T15:56:24.387Z",
        "confidence": "CONFIRMED",
        "evidence": [
          {
            "kind": "symbol",
            "ref": "src/Api/Contracts/WhatsApp/RecordWhatsAppShareRequest.cs#RecordWhatsAppShareRequest",
            "line": 14
          }
        ]
      },
      "last_verified_commit": "ae261733672cc9331dbadba1aa5d7d897e8890d2",
      "change_history": [],
      "entity_version": 1
    },
    {
      "id": "COMP-PLATFORM-056",
      "name": "SendWhatsAppMessageRequest",
      "kind": "dto",
      "path": "src/Api/Contracts/WhatsApp/SendWhatsAppMessageRequest.cs",
      "module": "WHATSAPP",
      "layer": "Api",
      "purpose": null,
      "simple_explanation": null,
      "technical_explanation": null,
      "knowledge_ref": null,
      "features": [],
      "requirements": [],
      "test_cases": [],
      "machine": {
        "namespace": "MathilensERP.Api.Contracts.WhatsApp",
        "declaration": "public sealed record SendWhatsAppMessageRequest(Guid CustomerId, Guid? OrderId, WhatsAppMessageType MessageType, string Content);",
        "line": 5,
        "modifiers": [
          "public",
          "sealed"
        ],
        "base_types": [],
        "attributes": [],
        "members": [
          {
            "name": "CustomerId",
            "kind": "property",
            "signature": "Guid CustomerId",
            "line": 5,
            "modifiers": [
              "positional"
            ],
            "attributes": []
          },
          {
            "name": "OrderId",
            "kind": "property",
            "signature": "Guid? OrderId",
            "line": 5,
            "modifiers": [
              "positional"
            ],
            "attributes": []
          },
          {
            "name": "MessageType",
            "kind": "property",
            "signature": "WhatsAppMessageType MessageType",
            "line": 5,
            "modifiers": [
              "positional"
            ],
            "attributes": []
          },
          {
            "name": "Content",
            "kind": "property",
            "signature": "string Content",
            "line": 5,
            "modifiers": [
              "positional"
            ],
            "attributes": []
          }
        ],
        "depends_on": [
          {
            "target": "Guid",
            "target_component": null,
            "via": "constructor-injection",
            "confidence": "CONFIRMED"
          },
          {
            "target": "Guid?",
            "target_component": null,
            "via": "constructor-injection",
            "confidence": "CONFIRMED"
          },
          {
            "target": "WhatsAppMessageType",
            "target_component": "COMP-WHATSAPP-016",
            "via": "constructor-injection",
            "confidence": "CONFIRMED"
          },
          {
            "target": "string",
            "target_component": null,
            "via": "constructor-injection",
            "confidence": "CONFIRMED"
          }
        ],
        "doc_citations": [],
        "incident_comments": [],
        "git": {
          "state": "COMMITTED",
          "last_commit": "84330f500134fc1d28946b7c4dbc5aa847b9f899",
          "last_commit_date": "2026-08-05",
          "last_commit_subject": "Add WhatsApp backend (Phase 3, module 2 of 4)",
          "commit_count": 1
        },
        "metrics": {
          "lines": 6,
          "member_count": 4,
          "dependency_count": 4
        }
      },
      "status": "active",
      "data_classification": "PUBLIC_SAFE",
      "provenance": {
        "generator": "harvest-source.mjs",
        "generator_version": "1.0.0",
        "generated_at": "2026-09-06T15:56:24.387Z",
        "confidence": "CONFIRMED",
        "evidence": [
          {
            "kind": "symbol",
            "ref": "src/Api/Contracts/WhatsApp/SendWhatsAppMessageRequest.cs#SendWhatsAppMessageRequest",
            "line": 5
          }
        ]
      },
      "last_verified_commit": "84330f500134fc1d28946b7c4dbc5aa847b9f899",
      "change_history": [],
      "entity_version": 1
    },
    {
      "id": "COMP-PLATFORM-071",
      "name": "WhatsAppMessagesController",
      "kind": "controller",
      "path": "src/Api/Controllers/V1/WhatsAppMessagesController.cs",
      "module": "WHATSAPP",
      "layer": "Api",
      "purpose": null,
      "simple_explanation": null,
      "technical_explanation": null,
      "knowledge_ref": "knowledge.html#103-every-endpoint",
      "features": [],
      "requirements": [],
      "test_cases": [],
      "machine": {
        "namespace": "MathilensERP.Api.Controllers.V1",
        "declaration": "public sealed class WhatsAppMessagesController : ApiControllerBase",
        "line": 22,
        "modifiers": [
          "public",
          "sealed"
        ],
        "base_types": [
          "ApiControllerBase"
        ],
        "attributes": [
          "ApiController",
          "Route(\"api/v1/whatsapp-messages\")",
          "Authorize(Policy = Permissions.WhatsAppView)"
        ],
        "members": [
          {
            "name": "WhatsAppMessagesController",
            "kind": "constructor",
            "signature": "public WhatsAppMessagesController(ISender sender)",
            "line": 26,
            "modifiers": [
              "public"
            ],
            "attributes": []
          },
          {
            "name": "RecordShareOpened",
            "kind": "method",
            "signature": "public async Task<IActionResult> RecordShareOpened([FromBody] RecordWhatsAppShareRequest request, CancellationToken cancellationToken)",
            "line": 40,
            "modifiers": [
              "public",
              "async"
            ],
            "attributes": [
              "HttpPost(\"share-opened\")",
              "ProducesResponseType(StatusCodes.Status204NoContent)",
              "ProducesResponseType(typeof(ApiErrorResponse), StatusCodes.Status404NotFound)"
            ],
            "http": {
              "method": "POST",
              "template": "share-opened",
              "resolved_route": "/api/v1/whatsapp-messages/share-opened",
              "policy": "Permissions.WhatsAppView",
              "allow_anonymous": false
            }
          },
          {
            "name": "Send",
            "kind": "method",
            "signature": "public async Task<IActionResult> Send([FromBody] SendWhatsAppMessageRequest request, CancellationToken cancellationToken)",
            "line": 52,
            "modifiers": [
              "public",
              "async"
            ],
            "attributes": [
              "HttpPost",
              "Authorize(Policy = Permissions.WhatsAppSend)",
              "ProducesResponseType(typeof(ApiResponse<WhatsAppMessageDto>), StatusCodes.Status200OK)",
              "ProducesResponseType(typeof(ApiErrorResponse), StatusCodes.Status400BadRequest)",